{
  "apiVersion": "guard.integration/v1alpha1",
  "kind": "GuardRunEnvelope",
  "runId": "archguard-matrix-block",
  "producer": {
    "guard": "archguard",
    "version": "0.1.0",
    "analyzerId": "archguard.cargo.workspace",
    "analyzerVersion": "0.1.0"
  },
  "binding": {
    "repoId": "repo",
    "taskId": "task",
    "worktreeId": "worktree",
    "requirementIds": [
      "R1"
    ],
    "candidateOid": "aaaaaaaaaaaaaaaaaaaaaaaaaaaaaaaaaaaaaaaa",
    "baseOid": "bbbbbbbbbbbbbbbbbbbbbbbbbbbbbbbbbbbbbbbb",
    "mergeGroupId": null,
    "sourceSnapshotDigest": "sha256:ddc445c0daf16eb2f8f224acbebfd325e6fa963bb00a848449824c20bba89b1f",
    "baselineDigest": null
  },
  "runStatus": "completed",
  "decision": "BLOCK",
  "coverage": {
    "status": "complete",
    "requiredScopes": [
      "lint"
    ],
    "observedScopes": [
      "lint"
    ],
    "missingScopes": []
  },
  "artifacts": {
    "contract": {
      "uri": "artifact://local/contract",
      "digest": "sha256:d7d2ac7bbd2f537d2bd6238a09067ea57ae8a245d748139a187b0dd760c474e0",
      "mediaType": "application/json"
    },
    "facts": {
      "uri": "artifact://local/facts",
      "digest": "sha256:76c527cc93ecfe9cf9a464d991e72bd73ee32a6c9fab3281d751e2bcab0b4f43",
      "mediaType": "application/json"
    },
    "report": {
      "uri": "artifact://local/report",
      "digest": "sha256:509ef8462d4a2a88dfd8da10eb955cb8e489d3e8e425d591a9075f438b9ec2c6",
      "mediaType": "application/json"
    },
    "domain": []
  },
  "approvalRefs": [],
  "diagnostics": [],
  "startedAt": "2026-10-09T10:00:00Z",
  "finishedAt": "2026-10-09T10:00:01Z",
  "expiresAt": null
}
