{
  "apiVersion": "guard.integration/v1alpha1",
  "kind": "GuardRunEnvelope",
  "runId": "lint-1290786-1791541723001665927",
  "producer": {
    "guard": "codeguard",
    "version": "0.1.4",
    "analyzerId": "codeguard.native-projection",
    "analyzerVersion": "0.1.0"
  },
  "binding": {
    "repoId": "repo",
    "taskId": "task",
    "worktreeId": "worktree",
    "requirementIds": [
      "ruff-f401"
    ],
    "candidateOid": "aaaaaaaaaaaaaaaaaaaaaaaaaaaaaaaaaaaaaaaa",
    "baseOid": "bbbbbbbbbbbbbbbbbbbbbbbbbbbbbbbbbbbbbbbb",
    "mergeGroupId": null,
    "sourceSnapshotDigest": "sha256:3727adff524e0616022eadd8f4af21a0778b29fc4c77bdfefd1afce2cbf5e4b7",
    "baselineDigest": null
  },
  "runStatus": "completed",
  "decision": "BLOCK",
  "coverage": {
    "status": "partial",
    "requiredScopes": [
      "python/ruff-f401/a6a3b165ae4d9dd7cf422f3b05e28958d67152036af1e3eb655d91357d6e8d7f"
    ],
    "observedScopes": [],
    "missingScopes": [
      "python/ruff-f401/a6a3b165ae4d9dd7cf422f3b05e28958d67152036af1e3eb655d91357d6e8d7f"
    ]
  },
  "artifacts": {
    "contract": {
      "uri": "artifact://lint-1290786-1791541723001665927/contract.json",
      "digest": "sha256:e81dcbd8d3d6e36e6147419019212a19f636a48777f1cad6d51967d457c81f3e",
      "mediaType": "application/json"
    },
    "facts": {
      "uri": "artifact://lint-1290786-1791541723001665927/facts.json",
      "digest": "sha256:e7c6ea647421f8ccc790da0e0f48649c0d1ba95dc21d08dcf2cde1b04797139a",
      "mediaType": "application/json"
    },
    "report": {
      "uri": "artifact://lint-1290786-1791541723001665927/report.json",
      "digest": "sha256:1f80248670e897ce6e577271ab5cf607ec99c975d8bde16d9982961199a5f0dd",
      "mediaType": "application/json"
    },
    "domain": [
      {
        "uri": "artifact://lint-1290786-1791541723001665927/native.json",
        "digest": "sha256:a7f57c9575ae2aa1f4689ac5ee86d60cd472eca325e61235ad88aaa2ebbb70e5",
        "mediaType": "application/json"
      }
    ]
  },
  "approvalRefs": [],
  "diagnostics": [
    {
      "code": "native_profile_unqualified",
      "message": "native_profile_unqualified",
      "retryable": false,
      "source": null
    }
  ],
  "startedAt": "2026-10-09T00:00:00Z",
  "finishedAt": "2026-10-09T00:01:00Z",
  "expiresAt": null
}