{"apiVersion":"guard.integration/v1alpha1","kind":"GuardRunEnvelope","runId":"native-001","producer":{"guard":"codeguard","version":"0.1.4","analyzerId":"codeguard.native-projection","analyzerVersion":"0.1.0"},"binding":{"repoId":"repo","taskId":"task","worktreeId":"worktree","requirementIds":["req"],"candidateOid":"aaaaaaaaaaaaaaaaaaaaaaaaaaaaaaaaaaaaaaaa","baseOid":"bbbbbbbbbbbbbbbbbbbbbbbbbbbbbbbbbbbbbbbb","mergeGroupId":null,"sourceSnapshotDigest":"sha256:aaaaaaaaaaaaaaaaaaaaaaaaaaaaaaaaaaaaaaaaaaaaaaaaaaaaaaaaaaaaaaaa","baselineDigest":null},"runStatus":"completed","decision":"BLOCK","coverage":{"status":"partial","requiredScopes":["python/app/lint/ruff"],"observedScopes":[],"missingScopes":["python/app/lint/ruff"]},"artifacts":{"contract":{"uri":"artifact://native-001/contract.json","digest":"sha256:693948231e9c4a15a58bf089d0151db7d6373c1e386fe82c505e52437136518c","mediaType":"application/json"},"facts":{"uri":"artifact://native-001/facts.json","digest":"sha256:d6f688c0270184d8515ae7b006c2f3f65b1b5920d3f386e6f34e6dd7b0176bca","mediaType":"application/json"},"report":{"uri":"artifact://native-001/report.json","digest":"sha256:c4f9e7b9e091327057471b62985ec69e6a59686858a316184be6704cee2d3946","mediaType":"application/json"},"domain":[{"uri":"artifact://native-001/native.json","digest":"sha256:ae61b0aca1b4a734bd8271fb6f1e81402c271b45761ae178f44ab89752f2ce9e","mediaType":"application/json"}]},"approvalRefs":[],"diagnostics":[{"code":"native_profile_unqualified","message":"native_profile_unqualified","retryable":false,"source":null}],"startedAt":"2026-10-09T00:00:00Z","finishedAt":"2026-10-09T00:01:00Z","expiresAt":null}