{
  "apiVersion": "guard.integration/v1alpha1",
  "kind": "GuardRunEnvelope",
  "runId": "archguard-matrix-advisory",
  "producer": {
    "guard": "archguard",
    "version": "0.1.0",
    "analyzerId": "archguard.cargo.workspace",
    "analyzerVersion": "0.1.0"
  },
  "binding": {
    "repoId": "repo",
    "taskId": "task",
    "worktreeId": "worktree",
    "requirementIds": [
      "R1"
    ],
    "candidateOid": "aaaaaaaaaaaaaaaaaaaaaaaaaaaaaaaaaaaaaaaa",
    "baseOid": "bbbbbbbbbbbbbbbbbbbbbbbbbbbbbbbbbbbbbbbb",
    "mergeGroupId": null,
    "sourceSnapshotDigest": "sha256:ddc445c0daf16eb2f8f224acbebfd325e6fa963bb00a848449824c20bba89b1f",
    "baselineDigest": null
  },
  "runStatus": "completed",
  "decision": "ALLOW",
  "coverage": {
    "status": "complete",
    "requiredScopes": [
      "lint"
    ],
    "observedScopes": [
      "lint"
    ],
    "missingScopes": []
  },
  "artifacts": {
    "contract": {
      "uri": "artifact://local/contract",
      "digest": "sha256:f459ce4a2a2ca63e8993593c770815c760e2ae2bc07cc42d61e4172757bc5a29",
      "mediaType": "application/json"
    },
    "facts": {
      "uri": "artifact://local/facts",
      "digest": "sha256:76c527cc93ecfe9cf9a464d991e72bd73ee32a6c9fab3281d751e2bcab0b4f43",
      "mediaType": "application/json"
    },
    "report": {
      "uri": "artifact://local/report",
      "digest": "sha256:8bc2c4772a848f205f030a2e277c25ed0c5c2918946615f86e307ea4b2fb2d00",
      "mediaType": "application/json"
    },
    "domain": []
  },
  "approvalRefs": [],
  "diagnostics": [],
  "startedAt": "2026-10-09T10:00:00Z",
  "finishedAt": "2026-10-09T10:00:01Z",
  "expiresAt": null
}
