{"apiVersion":"guard.integration/v1alpha1","kind":"GuardRunEnvelope","runId":"52685b5c68e15b3b57e56b798ad1bd5a0f985caf15df381271190d7ff78e77da","producer":{"guard":"GitGuard","version":"0.1.0","analyzerId":"gitguard.git-scope","analyzerVersion":"1"},"binding":{"repoId":"golden-repo","taskId":"golden-task","worktreeId":"golden-worktree","requirementIds":["R-GOLDEN"],"candidateOid":"156043d506c04ca23587035599aaed7cda172b92","baseOid":"2aec1efbe1eaf1310524e41e217f76685a9f0fa3","mergeGroupId":null,"sourceSnapshotDigest":"sha256:77a9a1f3b587a56264e48dd9e34f5a800471bb9602d01822e94fc66b7efc7452","baselineDigest":null},"runStatus":"completed","decision":"ALLOW","coverage":{"status":"complete","requiredScopes":["git.scope:097a0ebfec9eb591ca563913365792c741a8e66c498986463fb0f485e944c7e6","git.source-clean","git.submodule-contents"],"observedScopes":["git.scope:097a0ebfec9eb591ca563913365792c741a8e66c498986463fb0f485e944c7e6","git.source-clean","git.submodule-contents"],"missingScopes":[]},"artifacts":{"contract":{"uri":"artifact://gitguard/contract/a18057fde23d3735957b0c3f49f2c4dc64c6c5620b1967d3345c11dbf4502f65","digest":"sha256:a18057fde23d3735957b0c3f49f2c4dc64c6c5620b1967d3345c11dbf4502f65","mediaType":"application/json"},"facts":{"uri":"artifact://gitguard/facts/f0cd93211b08d916c0f9dc2f15ba7e6e2af237be940a75e560ef4b245fe675fd","digest":"sha256:f0cd93211b08d916c0f9dc2f15ba7e6e2af237be940a75e560ef4b245fe675fd","mediaType":"application/json"},"report":{"uri":"artifact://gitguard/report/fc1c71f53e8e2895d895a42237f93760c3cb31801da1136587c1d0223d9e112b","digest":"sha256:fc1c71f53e8e2895d895a42237f93760c3cb31801da1136587c1d0223d9e112b","mediaType":"application/json"},"domain":[{"uri":"artifact://gitguard/domain/0b83a2e9dd3f0c0d433e17d428dafa35d560b8a1d4b143e677a5725d9a0b1248","digest":"sha256:0b83a2e9dd3f0c0d433e17d428dafa35d560b8a1d4b143e677a5725d9a0b1248","mediaType":"application/json"}]},"approvalRefs":[],"diagnostics":[],"startedAt":"2026-10-09T09:39:26.869690864Z","finishedAt":"2026-10-09T09:39:26.937249707Z","expiresAt":null}