{"apiVersion":"guard.integration/v1alpha1","kind":"GuardRunEnvelope","runId":"native-001","producer":{"guard":"codeguard","version":"0.1.4","analyzerId":"codeguard.native-projection","analyzerVersion":"0.1.0"},"binding":{"repoId":"repo","taskId":"task","worktreeId":"worktree","requirementIds":["req"],"candidateOid":"aaaaaaaaaaaaaaaaaaaaaaaaaaaaaaaaaaaaaaaa","baseOid":"bbbbbbbbbbbbbbbbbbbbbbbbbbbbbbbbbbbbbbbb","mergeGroupId":null,"sourceSnapshotDigest":"sha256:aaaaaaaaaaaaaaaaaaaaaaaaaaaaaaaaaaaaaaaaaaaaaaaaaaaaaaaaaaaaaaaa","baselineDigest":null},"runStatus":"completed","decision":"BLOCK","coverage":{"status":"partial","requiredScopes":["python/app/lint/ruff"],"observedScopes":[],"missingScopes":["python/app/lint/ruff"]},"artifacts":{"contract":null,"facts":null,"report":null,"domain":[{"uri":"artifact://native-001/native.json","digest":"sha256:ae61b0aca1b4a734bd8271fb6f1e81402c271b45761ae178f44ab89752f2ce9e","mediaType":"application/json"}]},"approvalRefs":[],"diagnostics":[{"code":"native_profile_unqualified","message":"native_profile_unqualified","retryable":false,"source":null}],"startedAt":"2026-10-09T00:00:00Z","finishedAt":"2026-10-09T00:01:00Z","expiresAt":null}