{"apiVersion":"guard.integration/v1alpha1","kind":"GuardRunEnvelope","runId":"sha256:72fee63f4af4c86ba19a1824862a95cb6583df1ff7e5aa301f0e840282078ca2","producer":{"guard":"ArchGuard","version":"0.1.0","analyzerId":"archguard.cargo.declarations","analyzerVersion":"0.1.0"},"binding":{"repoId":"archguard-golden-repo","taskId":"golden-task","worktreeId":"golden-worktree","requirementIds":["R-GOLDEN"],"candidateOid":"1864d65ec1c56acfb93e21ed16c995e0152427ee","baseOid":"70eed42f497513d7265e45fd5abb88765f1d347f","mergeGroupId":null,"sourceSnapshotDigest":"sha256:22231782ae08badb7aa64e1e6283fe36bdd0eadda76c852ae4fa7f3a41cf590f","baselineDigest":null},"runStatus":"completed","decision":"BLOCK","coverage":{"status":"complete","requiredScopes":["cargo.declarations","cargo.member:sha256:080c6316b682001416f5f035d5fe8b701330f79e7e44a34e326e21f736b3efda","cargo.member:sha256:620eaa6b430b31f0fe8931028612d5830743335617632386b7204a8eb629f8dd","cargo.profile:sha256:cece049562a0b456a7f068a704f4cef33c7f41ce8cf20ab27cd8bb03d068d0f3","cargo.relation:sha256:c2a0b72a30d819c4cd2a9024a1a2cbf961f4de56f241300dd164c1b6fa38d43d"],"observedScopes":["cargo.declarations","cargo.member:sha256:080c6316b682001416f5f035d5fe8b701330f79e7e44a34e326e21f736b3efda","cargo.member:sha256:620eaa6b430b31f0fe8931028612d5830743335617632386b7204a8eb629f8dd","cargo.profile:sha256:cece049562a0b456a7f068a704f4cef33c7f41ce8cf20ab27cd8bb03d068d0f3","cargo.relation:sha256:c2a0b72a30d819c4cd2a9024a1a2cbf961f4de56f241300dd164c1b6fa38d43d"],"missingScopes":[]},"artifacts":{"contract":{"uri":"artifact://archguard/contract/058417d1f9eb816c108b9e63d2a20f0de0caad6684cddb594276168f076a0169","digest":"sha256:058417d1f9eb816c108b9e63d2a20f0de0caad6684cddb594276168f076a0169","mediaType":"application/json"},"facts":{"uri":"artifact://archguard/facts/5eba8fc6ccf0e64651e74d34bb641b22f81b3aa2cef34605a2b663f7fd2ffc7d","digest":"sha256:5eba8fc6ccf0e64651e74d34bb641b22f81b3aa2cef34605a2b663f7fd2ffc7d","mediaType":"application/json"},"report":{"uri":"artifact://archguard/report/b483dc7111d3ae557ee79c015237d3387b1df0af3339f5baef3e20b20b0a32c6","digest":"sha256:b483dc7111d3ae557ee79c015237d3387b1df0af3339f5baef3e20b20b0a32c6","mediaType":"application/json"},"domain":[{"uri":"artifact://archguard/domain/03293b99923b0dbe3dabaf1879eaef908c068e63bc90dc68fc44ad20735bc188","digest":"sha256:03293b99923b0dbe3dabaf1879eaef908c068e63bc90dc68fc44ad20735bc188","mediaType":"application/json"}]},"approvalRefs":[],"diagnostics":[],"startedAt":"2026-10-09T09:59:52.769988083Z","finishedAt":"2026-10-09T09:59:52.784322505Z","expiresAt":null}